claim,evidence,label,claim_clean,evidence_clean,combined_text
Lack of FGF21 in mice leads to atherosclerotic plaque formation.,"FGF21 deficiency causes a marked exacerbation of atherosclerotic plaque formation and premature death in apolipoprotein E(-/-) mice, which is accompanied by hypoadiponectinemia and severe hypercholesterolemia.",1,lack fgf mouse lead atherosclerotic plaque formation,fgf deficiency cause marked exacerbation atherosclerotic plaque formation premature death apolipoprotein e mouse accompanied hypoadiponectinemia severe hypercholesterolemia,lack fgf mouse lead atherosclerotic plaque formation fgf deficiency cause marked exacerbation atherosclerotic plaque formation premature death apolipoprotein e mouse accompanied hypoadiponectinemia severe hypercholesterolemia
Lack of FGF21 in mice leads to atherosclerotic plaque formation.,"Replenishment of FGF21 protects against atherosclerosis in apolipoprotein E(-/-)mice via 2 independent mechanisms, inducing the adipocyte production of adiponectin, which in turn acts on the blood vessels to inhibit neointima formation and macrophage inflammation, and suppressing the hepatic expression of the transcription factor sterol regulatory element-binding protein-2, thereby leading to reduced cholesterol synthesis and attenuation of hypercholesterolemia.",1,lack fgf mouse lead atherosclerotic plaque formation,replenishment fgf protects atherosclerosis apolipoprotein emice via independent mechanism inducing adipocyte production adiponectin turn act blood vessel inhibit neointima formation macrophage inflammation suppressing hepatic expression transcription factor sterol regulatory elementbinding protein thereby leading reduced cholesterol synthesis attenuation hypercholesterolemia,lack fgf mouse lead atherosclerotic plaque formation replenishment fgf protects atherosclerosis apolipoprotein emice via independent mechanism inducing adipocyte production adiponectin turn act blood vessel inhibit neointima formation macrophage inflammation suppressing hepatic expression transcription factor sterol regulatory elementbinding protein thereby leading reduced cholesterol synthesis attenuation hypercholesterolemia
Lack of FGF21 in mice leads to atherosclerotic plaque formation.,"CONCLUSIONS FGF21 protects against atherosclerosis via fine tuning the multiorgan crosstalk among liver, adipose tissue, and blood vessels.",1,lack fgf mouse lead atherosclerotic plaque formation,conclusion fgf protects atherosclerosis via fine tuning multiorgan crosstalk among liver adipose tissue blood vessel,lack fgf mouse lead atherosclerotic plaque formation conclusion fgf protects atherosclerosis via fine tuning multiorgan crosstalk among liver adipose tissue blood vessel
Lack of FGF21 in mice leads to reduced lifespan.,"FGF21 deficiency causes a marked exacerbation of atherosclerotic plaque formation and premature death in apolipoprotein E(-/-) mice, which is accompanied by hypoadiponectinemia and severe hypercholesterolemia.",1,lack fgf mouse lead reduced lifespan,fgf deficiency cause marked exacerbation atherosclerotic plaque formation premature death apolipoprotein e mouse accompanied hypoadiponectinemia severe hypercholesterolemia,lack fgf mouse lead reduced lifespan fgf deficiency cause marked exacerbation atherosclerotic plaque formation premature death apolipoprotein e mouse accompanied hypoadiponectinemia severe hypercholesterolemia
Lack of FGF21 in mice slows the rate of atherosclerotic plaque formation.,"FGF21 deficiency causes a marked exacerbation of atherosclerotic plaque formation and premature death in apolipoprotein E(-/-) mice, which is accompanied by hypoadiponectinemia and severe hypercholesterolemia.",0,lack fgf mouse slows rate atherosclerotic plaque formation,fgf deficiency cause marked exacerbation atherosclerotic plaque formation premature death apolipoprotein e mouse accompanied hypoadiponectinemia severe hypercholesterolemia,lack fgf mouse slows rate atherosclerotic plaque formation fgf deficiency cause marked exacerbation atherosclerotic plaque formation premature death apolipoprotein e mouse accompanied hypoadiponectinemia severe hypercholesterolemia
Lack of FGF21 in mice slows the rate of atherosclerotic plaque formation.,"Replenishment of FGF21 protects against atherosclerosis in apolipoprotein E(-/-)mice via 2 independent mechanisms, inducing the adipocyte production of adiponectin, which in turn acts on the blood vessels to inhibit neointima formation and macrophage inflammation, and suppressing the hepatic expression of the transcription factor sterol regulatory element-binding protein-2, thereby leading to reduced cholesterol synthesis and attenuation of hypercholesterolemia.",0,lack fgf mouse slows rate atherosclerotic plaque formation,replenishment fgf protects atherosclerosis apolipoprotein emice via independent mechanism inducing adipocyte production adiponectin turn act blood vessel inhibit neointima formation macrophage inflammation suppressing hepatic expression transcription factor sterol regulatory elementbinding protein thereby leading reduced cholesterol synthesis attenuation hypercholesterolemia,lack fgf mouse slows rate atherosclerotic plaque formation replenishment fgf protects atherosclerosis apolipoprotein emice via independent mechanism inducing adipocyte production adiponectin turn act blood vessel inhibit neointima formation macrophage inflammation suppressing hepatic expression transcription factor sterol regulatory elementbinding protein thereby leading reduced cholesterol synthesis attenuation hypercholesterolemia
Lack of FGF21 in mice slows the rate of atherosclerotic plaque formation.,"CONCLUSIONS FGF21 protects against atherosclerosis via fine tuning the multiorgan crosstalk among liver, adipose tissue, and blood vessels.",0,lack fgf mouse slows rate atherosclerotic plaque formation,conclusion fgf protects atherosclerosis via fine tuning multiorgan crosstalk among liver adipose tissue blood vessel,lack fgf mouse slows rate atherosclerotic plaque formation conclusion fgf protects atherosclerosis via fine tuning multiorgan crosstalk among liver adipose tissue blood vessel
Lamins are associated with nuclear membrane structure maintenance.,,0,lamins associated nuclear membrane structure maintenance,,lamins associated nuclear membrane structure maintenance 
Lamins are found within the inner layer of the mitochondrial membrane of all cells.,,0,lamins found within inner layer mitochondrial membrane cell,,lamins found within inner layer mitochondrial membrane cell 
Lamins are found within the inner layer of the nuclear membrane of all cells.,,0,lamins found within inner layer nuclear membrane cell,,lamins found within inner layer nuclear membrane cell 
Lamins have no effect on nuclear membrane structure maintenance.,,0,lamins effect nuclear membrane structure maintenance,,lamins effect nuclear membrane structure maintenance 
Less than 10% of patients exposed to radiation have activated markers of mesenchymal stem cells.,,0,less patient exposed radiation activated marker mesenchymal stem cell,,less patient exposed radiation activated marker mesenchymal stem cell 
Lice attenuated SIV vaccines induce a stronger antigen-specific T cell response in lymph node cells.,"Here we show that the degree of LAV-mediated protection against intravenous wild-type SIVmac239 challenge strongly correlates with the magnitude and function of SIV-specific, effector-differentiated T cells in the lymph node but not with the responses of such T cells in the blood or with other cellular, humoral and innate immune parameters.",1,louse attenuated siv vaccine induce stronger antigenspecific cell response lymph node cell,show degree lavmediated protection intravenous wildtype sivmac challenge strongly correlate magnitude function sivspecific effectordifferentiated cell lymph node response cell blood cellular humoral innate immune parameter,louse attenuated siv vaccine induce stronger antigenspecific cell response lymph node cell show degree lavmediated protection intravenous wildtype sivmac challenge strongly correlate magnitude function sivspecific effectordifferentiated cell lymph node response cell blood cellular humoral innate immune parameter
Lipopolysaccharides have an inflammation independent effect on kidney barrier function.,,0,lipopolysaccharides inflammation independent effect kidney barrier function,,lipopolysaccharides inflammation independent effect kidney barrier function 
Lmna knock-in models are appropriate for testing therapeutic approaches against Hutchinson-Gilford progeria syndrome (HGPS).,,0,lmna knockin model appropriate testing therapeutic approach hutchinsongilford progeria syndrome hgps,,lmna knockin model appropriate testing therapeutic approach hutchinsongilford progeria syndrome hgps 
Localization of PIN1 in the roots of Arabidopsis requires VPS9a,,0,localization pin root arabidopsis requires vpsa,,localization pin root arabidopsis requires vpsa 
Long - range chromatin interactions regulate transcription.,,0,long range chromatin interaction regulate transcription,,long range chromatin interaction regulate transcription 
Long chain polyunsaturated fatty acids supplementation has no significant effects on wheezing or asthma at 3 and 6 years.,,0,long chain polyunsaturated fatty acid supplementation significant effect wheezing asthma year,,long chain polyunsaturated fatty acid supplementation significant effect wheezing asthma year 
Long chain polyunsaturated fatty acids supplementation is associated with lower rates of atopic eczema at 1 year.,"RESULTS No differences were seen in the overall percentage of infants with immunoglobulin E associated allergic disease between the n-3 LCPUFA and control groups (32/368 (9%) v 43/338 (13%); unadjusted relative risk 0.68, 95% confidence interval 0.43 to 1.05, P=0.08; adjusted relative risk 0.70, 0.45 to 1.09, P=0.12), although the percentage of infants diagnosed as having atopic eczema (that is, eczema with associated sensitisation) was lower in the n-3 LCPUFA group (26/368 (7%) v 39/338 (12%); unadjusted relative risk 0.61, 0.38 to 0.98, P=0.04; adjusted relative risk 0.64, 0.40 to 1.02, P=0.06).",1,long chain polyunsaturated fatty acid supplementation associated lower rate atopic eczema year,result difference seen overall percentage infant immunoglobulin e associated allergic disease n lcpufa control group v unadjusted relative risk confidence interval p adjusted relative risk p although percentage infant diagnosed atopic eczema eczema associated sensitisation lower n lcpufa group v unadjusted relative risk p adjusted relative risk p,long chain polyunsaturated fatty acid supplementation associated lower rate atopic eczema year result difference seen overall percentage infant immunoglobulin e associated allergic disease n lcpufa control group v unadjusted relative risk confidence interval p adjusted relative risk p although percentage infant diagnosed atopic eczema eczema associated sensitisation lower n lcpufa group v unadjusted relative risk p adjusted relative risk p
Long chain polyunsaturated fatty acids supplementation is associated with lower rates of atopic eczema at 1 year.,"CONCLUSION n-3 LCPUFA supplementation in pregnancy did not reduce the overall incidence of immunoglobulin E associated allergies in the first year of life, although atopic eczema and egg sensitisation were lower.",1,long chain polyunsaturated fatty acid supplementation associated lower rate atopic eczema year,conclusion n lcpufa supplementation pregnancy reduce overall incidence immunoglobulin e associated allergy first year life although atopic eczema egg sensitisation lower,long chain polyunsaturated fatty acid supplementation associated lower rate atopic eczema year conclusion n lcpufa supplementation pregnancy reduce overall incidence immunoglobulin e associated allergy first year life although atopic eczema egg sensitisation lower
Long chain polyunsaturated fatty acids supplementation reduces wheezing and asthma.,,0,long chain polyunsaturated fatty acid supplementation reduces wheezing asthma,,long chain polyunsaturated fatty acid supplementation reduces wheezing asthma 
Low expression of miR7a does not repress target genes or exert a biological function in ovaries.,,0,low expression mira repress target gene exert biological function ovary,,low expression mira repress target gene exert biological function ovary 
Low expression of miR7a does not repress target genes or exert a biological function in testis.,,0,low expression mira repress target gene exert biological function testis,,low expression mira repress target gene exert biological function testis 
Low nucleosome occupancy correlates with high methylation levels across species.,"Clustered methylation occurs at unprecedented densities and directly disfavors nucleosomes, contributing to nucleosome positioning between clusters.",1,low nucleosome occupancy correlate high methylation level across specie,clustered methylation occurs unprecedented density directly disfavor nucleosomes contributing nucleosome positioning cluster,low nucleosome occupancy correlate high methylation level across specie clustered methylation occurs unprecedented density directly disfavor nucleosomes contributing nucleosome positioning cluster
Ly49Q directs the organization of neutrophil polarization by regulating membrane raft functions.,Ly49Q-dependent polarization and migration were affected by Ly49Q regulation of membrane raft functions.,1,lyq directs organization neutrophil polarization regulating membrane raft function,lyqdependent polarization migration affected lyq regulation membrane raft function,lyq directs organization neutrophil polarization regulating membrane raft function lyqdependent polarization migration affected lyq regulation membrane raft function
Ly49Q directs the organization of neutrophil polarization by regulating membrane raft functions.,"We propose that Ly49Q is pivotal in switching neutrophils to their polarized morphology and rapid migration upon inflammation, through its spatiotemporal regulation of membrane rafts and raft-associated signaling molecules.",1,lyq directs organization neutrophil polarization regulating membrane raft function,propose lyq pivotal switching neutrophil polarized morphology rapid migration upon inflammation spatiotemporal regulation membrane raft raftassociated signaling molecule,lyq directs organization neutrophil polarization regulating membrane raft function propose lyq pivotal switching neutrophil polarized morphology rapid migration upon inflammation spatiotemporal regulation membrane raft raftassociated signaling molecule
Ly6C hi monocytes have a higher inflammatory capacity than Ly6C lo monocytes.,"Under inflammatory conditions elicited either by acute infection with Listeria monocytogenes or chronic infection with Leishmania major, there was a significant increase in immature Ly-6C(high) monocytes, resembling the inflammatory left shift of granulocytes.",1,lyc hi monocyte higher inflammatory capacity lyc lo monocyte,inflammatory condition elicited either acute infection listeria monocytogenes chronic infection leishmania major significant increase immature lychigh monocyte resembling inflammatory left shift granulocyte,lyc hi monocyte higher inflammatory capacity lyc lo monocyte inflammatory condition elicited either acute infection listeria monocytogenes chronic infection leishmania major significant increase immature lychigh monocyte resembling inflammatory left shift granulocyte
Ly6C hi monocytes have a higher inflammatory capacity than Ly6C lo monocytes.,"In addition, acute peritoneal inflammation recruited preferentially Ly-6C(med-high) monocytes.",1,lyc hi monocyte higher inflammatory capacity lyc lo monocyte,addition acute peritoneal inflammation recruited preferentially lycmedhigh monocyte,lyc hi monocyte higher inflammatory capacity lyc lo monocyte addition acute peritoneal inflammation recruited preferentially lycmedhigh monocyte
Lysine histone demethylase inhibitor JIB 04 is inactive against KDM5A.,,0,lysine histone demethylase inhibitor jib inactive kdma,,lysine histone demethylase inhibitor jib inactive kdma 
M. stadtmanae does not induce ASC speck formation in BlaER1 monocytes.,,0,stadtmanae induce asc speck formation blaer monocyte,,stadtmanae induce asc speck formation blaer monocyte 
M. stadtmanae induces ASC speck formation in BlaER1 monocytes.,,0,stadtmanae induces asc speck formation blaer monocyte,,stadtmanae induces asc speck formation blaer monocyte 
MEK inhibitors are effective treatments in RAS-driven mouse models of cancer.,"However, when NVP-BEZ235 was combined with a mitogen-activated protein kinase kinase (MEK) inhibitor, ARRY-142886, there was marked synergy in shrinking these Kras-mutant cancers.",1,mek inhibitor effective treatment rasdriven mouse model cancer,however nvpbez combined mitogenactivated protein kinase kinase mek inhibitor arry marked synergy shrinking krasmutant cancer,mek inhibitor effective treatment rasdriven mouse model cancer however nvpbez combined mitogenactivated protein kinase kinase mek inhibitor arry marked synergy shrinking krasmutant cancer
MFGE8 regulates fat absorption by binding to av-Beta3 and av-Beta5 integrins.,"Mechanistically, we found that Mfge8 coordinates fatty acid uptake through αvβ3 integrin– and αvβ5 integrin–dependent phosphorylation of Akt by phosphatidylinositide-3 kinase and mTOR complex 2, leading to translocation of Cd36 and Fatp1 from cytoplasmic vesicles to the cell surface.",1,mfge regulates fat absorption binding avbeta avbeta integrins,mechanistically found mfge coordinate fatty acid uptake αvβ integrin αvβ integrindependent phosphorylation akt phosphatidylinositide kinase mtor complex leading translocation cd fatp cytoplasmic vesicle cell surface,mfge regulates fat absorption binding avbeta avbeta integrins mechanistically found mfge coordinate fatty acid uptake αvβ integrin αvβ integrindependent phosphorylation akt phosphatidylinositide kinase mtor complex leading translocation cd fatp cytoplasmic vesicle cell surface
MICAL redox enzymes regulate actin dynamics in many cell types.,"Instead of being integrated into a regular sarcomeric pattern, actin and myosin filaments are disorganized and accumulate beneath the plasmamembrane.",1,mical redox enzyme regulate actin dynamic many cell type,instead integrated regular sarcomeric pattern actin myosin filament disorganized accumulate beneath plasmamembrane,mical redox enzyme regulate actin dynamic many cell type instead integrated regular sarcomeric pattern actin myosin filament disorganized accumulate beneath plasmamembrane
MICAL redox enzymes regulate actin dynamics in many cell types.,Transgenic expression of interfering RNA molecules demonstrates that MICAL is required in muscles for the higher order arrangement of myofilaments.,1,mical redox enzyme regulate actin dynamic many cell type,transgenic expression interfering rna molecule demonstrates mical required muscle higher order arrangement myofilaments,mical redox enzyme regulate actin dynamic many cell type transgenic expression interfering rna molecule demonstrates mical required muscle higher order arrangement myofilaments
MICAL redox enzymes regulate actin dynamics in many cell types.,"In this study we show that in non-neural cells human MICALs are required for normal actin organization, and all three MICALs regulate actin stress fibers.",1,mical redox enzyme regulate actin dynamic many cell type,study show nonneural cell human micals required normal actin organization three micals regulate actin stress fiber,mical redox enzyme regulate actin dynamic many cell type study show nonneural cell human micals required normal actin organization three micals regulate actin stress fiber
MICAL redox enzymes regulate actin dynamics.,"Consistent with high expression of MICAL in somatic muscles, immunohistochemical stainings reveal that the subcellular localization and architecture of contractile muscle filaments are dramatically disturbed in mical mutants.",1,mical redox enzyme regulate actin dynamic,consistent high expression mical somatic muscle immunohistochemical staining reveal subcellular localization architecture contractile muscle filament dramatically disturbed mical mutant,mical redox enzyme regulate actin dynamic consistent high expression mical somatic muscle immunohistochemical staining reveal subcellular localization architecture contractile muscle filament dramatically disturbed mical mutant
MICAL redox enzymes regulate actin dynamics.,Transgenic expression of interfering RNA molecules demonstrates that MICAL is required in muscles for the higher order arrangement of myofilaments.,1,mical redox enzyme regulate actin dynamic,transgenic expression interfering rna molecule demonstrates mical required muscle higher order arrangement myofilaments,mical redox enzyme regulate actin dynamic transgenic expression interfering rna molecule demonstrates mical required muscle higher order arrangement myofilaments
MICAL redox enzymes regulate actin dynamics.,"In this study we show that in non-neural cells human MICALs are required for normal actin organization, and all three MICALs regulate actin stress fibers.",1,mical redox enzyme regulate actin dynamic,study show nonneural cell human micals required normal actin organization three micals regulate actin stress fiber,mical redox enzyme regulate actin dynamic study show nonneural cell human micals required normal actin organization three micals regulate actin stress fiber
MICAL redox enzymes regulate actin dynamics.,"Moreover, we provide evidence that the generation of reactive oxygen species by MICAL proteins is crucial for their actin-regulatory function.",1,mical redox enzyme regulate actin dynamic,moreover provide evidence generation reactive oxygen specie mical protein crucial actinregulatory function,mical redox enzyme regulate actin dynamic moreover provide evidence generation reactive oxygen specie mical protein crucial actinregulatory function
MICAL redox enzymes regulate actin dynamics.,These data suggest differential but complementary roles for MICAL1 and MICAL2 in actin microfilament regulation.,1,mical redox enzyme regulate actin dynamic,data suggest differential complementary role mical mical actin microfilament regulation,mical redox enzyme regulate actin dynamic data suggest differential complementary role mical mical actin microfilament regulation
MICAL redox enzymes regulate actin dynamics.,"Sema3A stimulation generated hydrogen peroxide (H2O2) through MICAL (molecule interacting with CasL) and oxidized CRMP2, enabling it to form a disulfide-linked homodimer through cysteine-504.",1,mical redox enzyme regulate actin dynamic,semaa stimulation generated hydrogen peroxide ho mical molecule interacting casl oxidized crmp enabling form disulfidelinked homodimer cysteine,mical redox enzyme regulate actin dynamic semaa stimulation generated hydrogen peroxide ho mical molecule interacting casl oxidized crmp enabling form disulfidelinked homodimer cysteine
MICAL redox enzymes regulate actin dynamics.,"Oxidized CRMP2 then formed a transient disulfide-linked complex with TRX, which stimulated CRMP2 phosphorylation by glycogen synthase kinase-3, leading to growth cone collapse.",1,mical redox enzyme regulate actin dynamic,oxidized crmp formed transient disulfidelinked complex trx stimulated crmp phosphorylation glycogen synthase kinase leading growth cone collapse,mical redox enzyme regulate actin dynamic oxidized crmp formed transient disulfidelinked complex trx stimulated crmp phosphorylation glycogen synthase kinase leading growth cone collapse
MICAL redox enzymes regulate actin dynamics.,Our results not only clarify the importance of H2O2 and CRMP2 oxidation in Sema3A-induced growth cone collapse but also indicate an unappreciated role for TRX in linking CRMP2 oxidation to phosphorylation.,1,mical redox enzyme regulate actin dynamic,result clarify importance ho crmp oxidation semaainduced growth cone collapse also indicate unappreciated role trx linking crmp oxidation phosphorylation,mical redox enzyme regulate actin dynamic result clarify importance ho crmp oxidation semaainduced growth cone collapse also indicate unappreciated role trx linking crmp oxidation phosphorylation
MT binding domain drives amyloid structure formation.,,0,mt binding domain drive amyloid structure formation,,mt binding domain drive amyloid structure formation 
MUC1-C activates the NF-κB p65 signaling pathway by interacting with IκB kinase ß.,"These findings indicate that MUC1 is important for physiological activation of IKKβ and that overexpression of MUC1, as found in human cancers, confers sustained induction of the IKKβ–NF-κB p65 pathway.",1,mucc activates nfκb p signaling pathway interacting iκb kinase ß,finding indicate muc important physiological activation ikkβ overexpression muc found human cancer confers sustained induction ikkβnfκb p pathway,mucc activates nfκb p signaling pathway interacting iκb kinase ß finding indicate muc important physiological activation ikkβ overexpression muc found human cancer confers sustained induction ikkβnfκb p pathway
MafA phosphorylation decreases its ubiquitination.,"We also demonstrate that GSK-3 triggers MafA sequential phosphorylation on residues S61, T57, T53, and S49, inducing its ubiquitination and degradation.",0,mafa phosphorylation decrease ubiquitination,also demonstrate gsk trigger mafa sequential phosphorylation residue inducing ubiquitination degradation,mafa phosphorylation decrease ubiquitination also demonstrate gsk trigger mafa sequential phosphorylation residue inducing ubiquitination degradation
